<?xml version="1.0" encoding="UTF-8"?>
<!DOCTYPE casino SYSTEM "main.dtd">
<casino>
    <game id="ID000" maxBet="1200" minBet="5" activePlayer="id_player_001">
        <!-- INSERT DECK HERE -->
        <dealer>
            <card hidden="false" color="diamond" value="6">
            </card>
            <card hidden="true" color="hearts" value="b">
            </card>
        </dealer>
        <player id="id_player_000" bet="10" balance="150" name="manuel" insurance="false">
            <card hidden="false" color="clubs" value="a">
            </card>
            <card hidden="false" color="spade" value="3">
            </card>
            <card hidden="false" color="diamond" value="5">
            </card>
        </player>
        <player id="id_player_001" bet="5" balance="150" name="michi" insurance="false">
            <card hidden="false" color="diamond" value="5">
            </card>
            <card hidden="false" color="clubs" value="7">
            </card>
        </player>
        <player id="id_player_002" bet="20" balance="150" name="robert" insurance="false">
            <card hidden="false" color="hearts" value="q">
            </card>
            <card hidden="false" color="clubs" value="a">
            </card>
        </player>
        <player id="id_player_003" bet="15" balance="150" name="anne" insurance="false">
            <card hidden="false" color="hearts" value="k">
            </card>
            <card hidden="false" color="spades" value="k">
            </card>
        </player>
        <player id="id_player_004" bet="10" balance="150" name="lenny" insurance="false">
            <card hidden="false" color="spades" value="3">
            </card>
            <card hidden="false" color="hearts" value="9">
            </card>
        </player>
    </game>
</casino>

<!-- Spieler id_player_000 hat "hit" ausgewÃ¤hlt und daraufhin "stand"
     Spieler id_player_001 ist nun an der Reihe und hat die "hit" oder "stand" Auswahl -->
